{
  "schema": "quantum-vault-cohort-binding/v1",
  "version": 1,
  "cohortType": "shard-cohort",
  "canonicalization": "QV-JSON-RFC8785-v1",
  "archiveId": "abababababababababababababababababababababababababababababababab",
  "stateId": "e72be26038375f48a0de6a43f3d04f2c0988f0c6634b688e60772877066180dbc19a6054ae2220ba202f945aee24e79b99be40171b391f7d91bd904a355e5117",
  "sharding": {
    "shamir": {
      "threshold": 4,
      "shareCount": 5
    },
    "reedSolomon": {
      "n": 5,
      "k": 3,
      "parity": 2,
      "codecId": "QV-RS-ErasureCodes-v1"
    }
  },
  "bodyDefinitionId": "QV-QCONT-SHARDBODY-v1",
  "bodyDefinition": {
    "includes": [
      "fragment-len32-stream"
    ],
    "excludes": [
      "qcont-header",
      "embedded-archive-state",
      "embedded-archive-state-digest",
      "embedded-cohort-binding",
      "embedded-cohort-binding-digest",
      "embedded-lifecycle-bundle",
      "embedded-lifecycle-bundle-digest",
      "external-signatures"
    ]
  },
  "shardBodyHashAlg": "SHA3-512",
  "shardBodyHashes": [
    "11111111111111111111111111111111111111111111111111111111111111111111111111111111111111111111111111111111111111111111111111111111",
    "22222222222222222222222222222222222222222222222222222222222222222222222222222222222222222222222222222222222222222222222222222222",
    "33333333333333333333333333333333333333333333333333333333333333333333333333333333333333333333333333333333333333333333333333333333",
    "44444444444444444444444444444444444444444444444444444444444444444444444444444444444444444444444444444444444444444444444444444444",
    "55555555555555555555555555555555555555555555555555555555555555555555555555555555555555555555555555555555555555555555555555555555"
  ],
  "shareCommitment": {
    "hashAlg": "SHA3-512",
    "input": "raw-shamir-share-bytes"
  },
  "shareCommitments": [
    "66666666666666666666666666666666666666666666666666666666666666666666666666666666666666666666666666666666666666666666666666666666",
    "77777777777777777777777777777777777777777777777777777777777777777777777777777777777777777777777777777777777777777777777777777777",
    "88888888888888888888888888888888888888888888888888888888888888888888888888888888888888888888888888888888888888888888888888888888",
    "99999999999999999999999999999999999999999999999999999999999999999999999999999999999999999999999999999999999999999999999999999999",
    "aaaaaaaaaaaaaaaaaaaaaaaaaaaaaaaaaaaaaaaaaaaaaaaaaaaaaaaaaaaaaaaaaaaaaaaaaaaaaaaaaaaaaaaaaaaaaaaaaaaaaaaaaaaaaaaaaaaaaaaaaaaaaaaa"
  ]
}
